name,price,desc,img,category
Ball,25,Soccer ball has a machine-stitched body with nylon and TPU materials for a soft touch.,ball.jpg,football
Shoes,50,The premium synthetic leather has a 3-D texture on key areas to provide targeted friction and a precise touch.,shoes.jpg,football
Shirt,50,Training Shirt features team details on soft sweat-wicking fabric to help keep you dry and comfortable during your workout.,shirt.jpg,football
Stick,15,Tough rigid 47" stick specially designed to take the force of rugged play.,stick.jpg,hockey
Puck,5,A must have for every Wisconsin Badgers hockey fan!,puck.jpg,hockey
Helmet,300,Hockey helmet that features the Suspend-Tech 2 liner system with FleXorb Technology for superior impact absorption and better rotational management.,helmet.jpg,hockey
Racket,10,Table Tennis Racket consists of competition-style rubber with 1.6 mm sponge for precise control spin and speed.,racket.jpg,tennis
Balls,3,Seamless 1-star table tennis 6 balls.,balls.jpg,tennis
Table,200,Table Tennis Table boasts a responsive 5/8"" surface so you can make impressive side spins smashes and forehand drives.,table.jpg,tennis